{
  "schema": "rusty.quest.sidecar.manifold_response_implementation_preflight.v1",
  "preflight_id": "preflight.manifold_response_implementation.synthetic.001",
  "generated_at": "2026-06-04T23:28:00Z",
  "preflight_status": "ready_for_manifold_repo_slice_planning",
  "source_manifold_route_design_response_expectation": {
    "path": "fixtures/valid/manifold-route-design-response-expectation.synthetic.json",
    "schema": "rusty.quest.sidecar.manifold_route_design_response_expectation.v1",
    "expectation_id": "expectation.manifold_route_design_response.synthetic.001",
    "expectation_status": "ready_for_manifold_owned_response",
    "next_gate": "manifold_owned_response_or_operator_decision"
  },
  "implementation_preflight_scope": {
    "preflight_class": "manifold_repo_response_slice_preflight",
    "source_mode": "synthetic_fixture",
    "target_repo": "rusty.manifold",
    "repo_touch_status": "not_touched",
    "branch_status": "not_created",
    "response_status": "not_created",
    "decision_status": "not_decided",
    "route_status": "not_created",
    "accepted_state_status": "not_created",
    "audit_record_status": "not_created",
    "hostess_route_status": "not_created",
    "live_evidence_status": "not_included"
  },
  "authority": {
    "preflight_owner": "rusty.quest.sidecar_mesh",
    "implementation_plan_owner": "rusty.manifold",
    "response_owner": "rusty.manifold",
    "decision_owner": "rusty.manifold",
    "route_implementation_owner": "rusty.manifold",
    "request_acceptance_owner": "rusty.manifold",
    "runtime_authority_owner": "rusty.manifold",
    "session_authority_owner": "rusty.manifold",
    "audit_owner": "rusty.manifold.audit",
    "accepted_state_owner": "rusty.manifold",
    "rollback_owner": "rusty.manifold",
    "hostess_device_action_authority": "not_in_sidecar",
    "sidecar_role": "observer_proposer",
    "proposal_status": "not_accepted"
  },
  "manifold_repo_slice_requirements": {
    "slice_class": "manifold_owned_sidecar_peer_status_response_slice",
    "target_repo": "rusty.manifold",
    "implementation_status": "not_created_by_sidecar",
    "required_manifold_owned_artifacts": [
      {
        "artifact_id": "artifact.sidecar_peer_status_design_response_schema",
        "artifact_kind": "schema",
        "owner": "rusty.manifold",
        "status": "not_created_by_sidecar",
        "evidence_source": "expected_manifold_response.required_fields"
      },
      {
        "artifact_id": "artifact.sidecar_peer_status_route_handler",
        "artifact_kind": "route_handler",
        "owner": "rusty.manifold",
        "status": "not_created_by_sidecar",
        "evidence_source": "source_manifold_route_design_review_request"
      },
      {
        "artifact_id": "artifact.sidecar_peer_status_decision_event_fixture",
        "artifact_kind": "decision_event_fixture",
        "owner": "rusty.manifold",
        "status": "not_created_by_sidecar",
        "evidence_source": "expected_manifold_response.allowed_decisions"
      },
      {
        "artifact_id": "artifact.sidecar_peer_status_accepted_state_fixture",
        "artifact_kind": "accepted_state_fixture",
        "owner": "rusty.manifold",
        "status": "not_created_by_sidecar",
        "evidence_source": "expected_manifold_response.accepted_state_policy"
      },
      {
        "artifact_id": "artifact.sidecar_peer_status_audit_fixture",
        "artifact_kind": "audit_fixture",
        "owner": "rusty.manifold.audit",
        "status": "not_created_by_sidecar",
        "evidence_source": "expected_manifold_response.required_audit_terms"
      },
      {
        "artifact_id": "artifact.sidecar_peer_status_hostess_boundary_descriptor",
        "artifact_kind": "hostess_boundary_descriptor",
        "owner": "rusty.manifold",
        "status": "not_created_by_sidecar",
        "evidence_source": "hostess_response_gate"
      }
    ],
    "required_validation_slots": [
      "slot.manifold_response_schema_contract",
      "slot.sidecar_design_response_valid_fixture",
      "slot.sidecar_design_response_damaged_fixture",
      "slot.manifold_route_unit_tests",
      "slot.manifold_audit_fixture",
      "slot.hostess_boundary_descriptor_check",
      "slot.privacy_redaction_rejection_check"
    ],
    "required_response_decisions": [
      "accepted_for_manifold_slice",
      "revision_requested",
      "rejected"
    ],
    "required_rejection_terms": [
      "operator_approval_missing",
      "endpoint_values_rejected",
      "commands_rejected",
      "adb_rejected",
      "stale_peer_status",
      "untrusted_sidecar",
      "redaction_incomplete",
      "high_rate_payload_rejected"
    ],
    "required_route_boundaries": {
      "input_payload_class": "low_rate_advisory_status",
      "allows_endpoint_values": false,
      "allows_commands": false,
      "allows_adb": false,
      "allows_high_rate_payloads": false,
      "allows_sidecar_direct_hostess_input": false
    },
    "rollback_policy": "manifold_owned_disable_route_or_reject_source"
  },
  "hostess_boundary_preflight": {
    "status": "future_lane_not_requested",
    "route_status": "not_created",
    "device_action_authority": "not_in_sidecar",
    "consumes_only": "manifold_accepted_state_or_operator_request_descriptor",
    "sidecar_direct_input_allowed": false,
    "requires_manifold_accepted_state": true,
    "requires_explicit_operator_request": true,
    "allowed_action_class": "operator_recovery_request_descriptor",
    "preflight_result": "hostess_deferred_until_manifold_acceptance"
  },
  "validation_evidence": {
    "local_validation_status": "expected_pass",
    "required_commands": [
      "python tools/prepare_manifold_response_implementation_preflight.py --response-expectation fixtures/valid/manifold-route-design-response-expectation.synthetic.json --now 2026-06-04T23:28:00Z --output fixtures/valid/manifold-response-implementation-preflight.synthetic.json",
      "python tools/evaluate_integration_acceptance.py --repo-root . --now 2026-06-04T21:46:00Z --output fixtures/valid/integration-acceptance-scorecard.synthetic.json",
      "python tools/validate_repo.py --repo-root .",
      "python -m unittest discover -s tests -p test_*.py",
      "git diff --check"
    ],
    "damaged_fixture_policy": "must_fail_validation",
    "future_manifold_gate": "manifold_repo_owns_response_slice_implementation_and_audit",
    "future_hostess_gate": "hostess_route_requires_manifold_state_or_operator_request"
  },
  "privacy_boundary": {
    "contains_endpoint_values": false,
    "contains_pairing_material": false,
    "contains_commands": false,
    "contains_raw_logs": false,
    "contains_visual_captures": false,
    "contains_private_device_ids": false,
    "public_fixture_policy": "synthetic_descriptor_only"
  },
  "checks": [
    {
      "check_id": "manifold_response_preflight.source_expectation_ready",
      "status": "pass",
      "observed": {
        "schema": "rusty.quest.sidecar.manifold_route_design_response_expectation.v1",
        "expectation_status": "ready_for_manifold_owned_response",
        "next_gate": "manifold_owned_response_or_operator_decision"
      },
      "expected": {
        "schema": "rusty.quest.sidecar.manifold_route_design_response_expectation.v1",
        "expectation_status": "ready_for_manifold_owned_response",
        "next_gate": "manifold_owned_response_or_operator_decision"
      },
      "evidence": "fixtures/valid/manifold-route-design-response-expectation.synthetic.json"
    },
    {
      "check_id": "manifold_response_preflight.no_repo_response_route_or_state",
      "status": "pass",
      "observed": {
        "preflight_class": "manifold_repo_response_slice_preflight",
        "source_mode": "synthetic_fixture",
        "target_repo": "rusty.manifold",
        "repo_touch_status": "not_touched",
        "branch_status": "not_created",
        "response_status": "not_created",
        "decision_status": "not_decided",
        "route_status": "not_created",
        "accepted_state_status": "not_created",
        "audit_record_status": "not_created",
        "hostess_route_status": "not_created",
        "live_evidence_status": "not_included"
      },
      "expected": {
        "repo_touch_status": "not_touched",
        "branch_status": "not_created",
        "response_status": "not_created",
        "decision_status": "not_decided",
        "route_status": "not_created",
        "accepted_state_status": "not_created",
        "audit_record_status": "not_created",
        "hostess_route_status": "not_created",
        "live_evidence_status": "not_included"
      },
      "evidence": "preflight does not touch Manifold, create branch, response, decision, route, state, audit, Hostess route, or live evidence"
    },
    {
      "check_id": "manifold_response_preflight.manifold_authority",
      "status": "pass",
      "observed": {
        "preflight_owner": "rusty.quest.sidecar_mesh",
        "implementation_plan_owner": "rusty.manifold",
        "response_owner": "rusty.manifold",
        "decision_owner": "rusty.manifold",
        "route_implementation_owner": "rusty.manifold",
        "request_acceptance_owner": "rusty.manifold",
        "runtime_authority_owner": "rusty.manifold",
        "session_authority_owner": "rusty.manifold",
        "audit_owner": "rusty.manifold.audit",
        "accepted_state_owner": "rusty.manifold",
        "rollback_owner": "rusty.manifold",
        "hostess_device_action_authority": "not_in_sidecar",
        "sidecar_role": "observer_proposer",
        "proposal_status": "not_accepted"
      },
      "expected": {
        "implementation_plan_owner": "rusty.manifold",
        "response_owner": "rusty.manifold",
        "decision_owner": "rusty.manifold",
        "route_implementation_owner": "rusty.manifold",
        "request_acceptance_owner": "rusty.manifold",
        "runtime_authority_owner": "rusty.manifold",